{
  "schemaVersion": 1,
  "generator": "@naresh007/project-structure-generator",
  "generatorVersion": "0.2.3",
  "generatedAt": "2026-08-06T09:01:54.257Z",
  "blueprint": {
    "kind": "blueprint",
    "id": "typescript-cli-modular",
    "source": "built-in",
    "version": "1.0.0"
  },
  "maturity": "operational",
  "capabilities": [
    {
      "kind": "pack",
      "id": "docker",
      "source": "built-in"
    },
    {
      "kind": "pack",
      "id": "github-actions",
      "source": "built-in"
    },
    {
      "kind": "pack",
      "id": "structured-logging",
      "source": "built-in"
    },
    {
      "kind": "pack",
      "id": "unit-tests",
      "source": "built-in"
    }
  ],
  "variables": {
    "projectName": "my-cli",
    "projectNameKebab": "my-cli",
    "projectNameSnake": "my_cli",
    "projectNameCamel": "myCli",
    "projectNamePascal": "MyCli",
    "projectNameConstant": "MY_CLI",
    "projectNamePath": "my-cli",
    "cliCommand": "my-cli",
    "cliCommandKebab": "my-cli",
    "cliCommandSnake": "my_cli",
    "cliCommandCamel": "myCli",
    "cliCommandPascal": "MyCli",
    "cliCommandConstant": "MY_CLI",
    "cliCommandPath": "my-cli",
    "projectNameKebabKebab": "my-cli",
    "projectNameKebabSnake": "my_cli",
    "projectNameKebabCamel": "myCli",
    "projectNameKebabPascal": "MyCli",
    "projectNameKebabConstant": "MY_CLI",
    "projectNameKebabPath": "my-cli",
    "projectNameSnakeKebab": "my-cli",
    "projectNameSnakeSnake": "my_cli",
    "projectNameSnakeCamel": "myCli",
    "projectNameSnakePascal": "MyCli",
    "projectNameSnakeConstant": "MY_CLI",
    "projectNameSnakePath": "my_cli",
    "projectNameCamelKebab": "my-cli",
    "projectNameCamelSnake": "my_cli",
    "projectNameCamelCamel": "myCli",
    "projectNameCamelPascal": "MyCli",
    "projectNameCamelConstant": "MY_CLI",
    "projectNameCamelPath": "myCli",
    "projectNamePascalKebab": "my-cli",
    "projectNamePascalSnake": "my_cli",
    "projectNamePascalCamel": "myCli",
    "projectNamePascalPascal": "MyCli",
    "projectNamePascalConstant": "MY_CLI",
    "projectNamePascalPath": "MyCli",
    "projectNameConstantKebab": "my-cli",
    "projectNameConstantSnake": "my_cli",
    "projectNameConstantCamel": "myCli",
    "projectNameConstantPascal": "MyCli",
    "projectNameConstantConstant": "MY_CLI",
    "projectNameConstantPath": "MY_CLI",
    "projectNamePathKebab": "my-cli",
    "projectNamePathSnake": "my_cli",
    "projectNamePathCamel": "myCli",
    "projectNamePathPascal": "MyCli",
    "projectNamePathConstant": "MY_CLI",
    "projectNamePathPath": "my-cli",
    "cliCommandKebabKebab": "my-cli",
    "cliCommandKebabSnake": "my_cli",
    "cliCommandKebabCamel": "myCli",
    "cliCommandKebabPascal": "MyCli",
    "cliCommandKebabConstant": "MY_CLI",
    "cliCommandKebabPath": "my-cli",
    "cliCommandSnakeKebab": "my-cli",
    "cliCommandSnakeSnake": "my_cli",
    "cliCommandSnakeCamel": "myCli",
    "cliCommandSnakePascal": "MyCli",
    "cliCommandSnakeConstant": "MY_CLI",
    "cliCommandSnakePath": "my_cli",
    "cliCommandCamelKebab": "my-cli",
    "cliCommandCamelSnake": "my_cli",
    "cliCommandCamelCamel": "myCli",
    "cliCommandCamelPascal": "MyCli",
    "cliCommandCamelConstant": "MY_CLI",
    "cliCommandCamelPath": "myCli",
    "cliCommandPascalKebab": "my-cli",
    "cliCommandPascalSnake": "my_cli",
    "cliCommandPascalCamel": "myCli",
    "cliCommandPascalPascal": "MyCli",
    "cliCommandPascalConstant": "MY_CLI",
    "cliCommandPascalPath": "MyCli",
    "cliCommandConstantKebab": "my-cli",
    "cliCommandConstantSnake": "my_cli",
    "cliCommandConstantCamel": "myCli",
    "cliCommandConstantPascal": "MyCli",
    "cliCommandConstantConstant": "MY_CLI",
    "cliCommandConstantPath": "MY_CLI",
    "cliCommandPathKebab": "my-cli",
    "cliCommandPathSnake": "my_cli",
    "cliCommandPathCamel": "myCli",
    "cliCommandPathPascal": "MyCli",
    "cliCommandPathConstant": "MY_CLI",
    "cliCommandPathPath": "my-cli"
  },
  "files": [
    ".dockerignore",
    ".github/workflows/ci.yml",
    ".gitignore",
    "Dockerfile",
    "README.md",
    "config/logging.json",
    "package.json",
    "src/cli/commands/hello.ts",
    "src/core/errors/app-error.ts",
    "src/index.ts",
    "tests/unit/hello.test.ts",
    "tests/unit/test_unit.py",
    "tsconfig.json"
  ]
}