{
  "schemaVersion": 1,
  "generator": "@naresh007/project-structure-generator",
  "generatorVersion": "0.2.4",
  "generatedAt": "2026-08-06T09:06:30.283Z",
  "blueprint": {
    "kind": "blueprint",
    "id": "nextjs-feature-modular",
    "source": "built-in",
    "version": "1.0.0"
  },
  "maturity": "operational",
  "capabilities": [
    {
      "kind": "pack",
      "id": "docker",
      "source": "built-in"
    },
    {
      "kind": "pack",
      "id": "github-actions",
      "source": "built-in"
    },
    {
      "kind": "pack",
      "id": "structured-logging",
      "source": "built-in"
    },
    {
      "kind": "pack",
      "id": "unit-tests",
      "source": "built-in"
    }
  ],
  "variables": {
    "projectName": "my-nextjs-app",
    "projectNameKebab": "my-nextjs-app",
    "projectNameSnake": "my_nextjs_app",
    "projectNameCamel": "myNextjsApp",
    "projectNamePascal": "MyNextjsApp",
    "projectNameConstant": "MY_NEXTJS_APP",
    "projectNamePath": "my-nextjs-app",
    "projectNameKebabKebab": "my-nextjs-app",
    "projectNameKebabSnake": "my_nextjs_app",
    "projectNameKebabCamel": "myNextjsApp",
    "projectNameKebabPascal": "MyNextjsApp",
    "projectNameKebabConstant": "MY_NEXTJS_APP",
    "projectNameKebabPath": "my-nextjs-app",
    "projectNameSnakeKebab": "my-nextjs-app",
    "projectNameSnakeSnake": "my_nextjs_app",
    "projectNameSnakeCamel": "myNextjsApp",
    "projectNameSnakePascal": "MyNextjsApp",
    "projectNameSnakeConstant": "MY_NEXTJS_APP",
    "projectNameSnakePath": "my_nextjs_app",
    "projectNameCamelKebab": "my-nextjs-app",
    "projectNameCamelSnake": "my_nextjs_app",
    "projectNameCamelCamel": "myNextjsApp",
    "projectNameCamelPascal": "MyNextjsApp",
    "projectNameCamelConstant": "MY_NEXTJS_APP",
    "projectNameCamelPath": "myNextjsApp",
    "projectNamePascalKebab": "my-nextjs-app",
    "projectNamePascalSnake": "my_nextjs_app",
    "projectNamePascalCamel": "myNextjsApp",
    "projectNamePascalPascal": "MyNextjsApp",
    "projectNamePascalConstant": "MY_NEXTJS_APP",
    "projectNamePascalPath": "MyNextjsApp",
    "projectNameConstantKebab": "my-nextjs-app",
    "projectNameConstantSnake": "my_nextjs_app",
    "projectNameConstantCamel": "myNextjsApp",
    "projectNameConstantPascal": "MyNextjsApp",
    "projectNameConstantConstant": "MY_NEXTJS_APP",
    "projectNameConstantPath": "MY_NEXTJS_APP",
    "projectNamePathKebab": "my-nextjs-app",
    "projectNamePathSnake": "my_nextjs_app",
    "projectNamePathCamel": "myNextjsApp",
    "projectNamePathPascal": "MyNextjsApp",
    "projectNamePathConstant": "MY_NEXTJS_APP",
    "projectNamePathPath": "my-nextjs-app"
  },
  "files": [
    ".dockerignore",
    ".env.example",
    ".github/workflows/ci.yml",
    ".gitignore",
    "Dockerfile",
    "README.md",
    "config/logging.json",
    "next.config.ts",
    "package.json",
    "src/app/(application)/dashboard/page.tsx",
    "src/app/(public)/page.tsx",
    "src/app/api/health/route.ts",
    "src/app/globals.css",
    "src/app/layout.tsx",
    "src/app/page.tsx",
    "src/components/shared/README.md",
    "src/components/ui/README.md",
    "src/config/environment.ts",
    "src/features/authentication/actions/authentication.ts",
    "src/features/authentication/api/client.ts",
    "src/features/authentication/components/AuthenticationForm.tsx",
    "src/features/authentication/hooks/useAuthentication.ts",
    "src/features/authentication/index.ts",
    "src/features/authentication/schemas/authentication.schema.ts",
    "src/features/authentication/server/authentication.service.ts",
    "src/features/authentication/tests/AuthenticationForm.test.tsx",
    "src/features/authentication/types/index.ts",
    "src/lib/dal/index.ts",
    "src/lib/server/environment.ts",
    "src/types/index.ts",
    "tests/unit/test_unit.py",
    "tsconfig.json"
  ]
}