{
  "schemaVersion": 1,
  "generator": "@naresh007/project-structure-generator",
  "generatorVersion": "0.2.3",
  "generatedAt": "2026-08-06T09:01:28.048Z",
  "blueprint": {
    "kind": "blueprint",
    "id": "python-fastapi-feature-modular",
    "source": "built-in",
    "version": "1.0.0"
  },
  "maturity": "operational",
  "capabilities": [
    {
      "kind": "pack",
      "id": "postgres",
      "source": "built-in"
    },
    {
      "kind": "pack",
      "id": "opentelemetry",
      "source": "built-in"
    },
    {
      "kind": "pack",
      "id": "structured-logging",
      "source": "built-in"
    },
    {
      "kind": "pack",
      "id": "unit-tests",
      "source": "built-in"
    }
  ],
  "variables": {
    "projectName": "my-fastapi-app",
    "projectNameKebab": "my-fastapi-app",
    "projectNameSnake": "my_fastapi_app",
    "projectNameCamel": "myFastapiApp",
    "projectNamePascal": "MyFastapiApp",
    "projectNameConstant": "MY_FASTAPI_APP",
    "projectNamePath": "my-fastapi-app",
    "packageName": "my_fastapi_app",
    "packageNameKebab": "my-fastapi-app",
    "packageNameSnake": "my_fastapi_app",
    "packageNameCamel": "myFastapiApp",
    "packageNamePascal": "MyFastapiApp",
    "packageNameConstant": "MY_FASTAPI_APP",
    "packageNamePath": "my_fastapi_app",
    "projectNameKebabKebab": "my-fastapi-app",
    "projectNameKebabSnake": "my_fastapi_app",
    "projectNameKebabCamel": "myFastapiApp",
    "projectNameKebabPascal": "MyFastapiApp",
    "projectNameKebabConstant": "MY_FASTAPI_APP",
    "projectNameKebabPath": "my-fastapi-app",
    "projectNameSnakeKebab": "my-fastapi-app",
    "projectNameSnakeSnake": "my_fastapi_app",
    "projectNameSnakeCamel": "myFastapiApp",
    "projectNameSnakePascal": "MyFastapiApp",
    "projectNameSnakeConstant": "MY_FASTAPI_APP",
    "projectNameSnakePath": "my_fastapi_app",
    "projectNameCamelKebab": "my-fastapi-app",
    "projectNameCamelSnake": "my_fastapi_app",
    "projectNameCamelCamel": "myFastapiApp",
    "projectNameCamelPascal": "MyFastapiApp",
    "projectNameCamelConstant": "MY_FASTAPI_APP",
    "projectNameCamelPath": "myFastapiApp",
    "projectNamePascalKebab": "my-fastapi-app",
    "projectNamePascalSnake": "my_fastapi_app",
    "projectNamePascalCamel": "myFastapiApp",
    "projectNamePascalPascal": "MyFastapiApp",
    "projectNamePascalConstant": "MY_FASTAPI_APP",
    "projectNamePascalPath": "MyFastapiApp",
    "projectNameConstantKebab": "my-fastapi-app",
    "projectNameConstantSnake": "my_fastapi_app",
    "projectNameConstantCamel": "myFastapiApp",
    "projectNameConstantPascal": "MyFastapiApp",
    "projectNameConstantConstant": "MY_FASTAPI_APP",
    "projectNameConstantPath": "MY_FASTAPI_APP",
    "projectNamePathKebab": "my-fastapi-app",
    "projectNamePathSnake": "my_fastapi_app",
    "projectNamePathCamel": "myFastapiApp",
    "projectNamePathPascal": "MyFastapiApp",
    "projectNamePathConstant": "MY_FASTAPI_APP",
    "projectNamePathPath": "my-fastapi-app",
    "packageNameKebabKebab": "my-fastapi-app",
    "packageNameKebabSnake": "my_fastapi_app",
    "packageNameKebabCamel": "myFastapiApp",
    "packageNameKebabPascal": "MyFastapiApp",
    "packageNameKebabConstant": "MY_FASTAPI_APP",
    "packageNameKebabPath": "my-fastapi-app",
    "packageNameSnakeKebab": "my-fastapi-app",
    "packageNameSnakeSnake": "my_fastapi_app",
    "packageNameSnakeCamel": "myFastapiApp",
    "packageNameSnakePascal": "MyFastapiApp",
    "packageNameSnakeConstant": "MY_FASTAPI_APP",
    "packageNameSnakePath": "my_fastapi_app",
    "packageNameCamelKebab": "my-fastapi-app",
    "packageNameCamelSnake": "my_fastapi_app",
    "packageNameCamelCamel": "myFastapiApp",
    "packageNameCamelPascal": "MyFastapiApp",
    "packageNameCamelConstant": "MY_FASTAPI_APP",
    "packageNameCamelPath": "myFastapiApp",
    "packageNamePascalKebab": "my-fastapi-app",
    "packageNamePascalSnake": "my_fastapi_app",
    "packageNamePascalCamel": "myFastapiApp",
    "packageNamePascalPascal": "MyFastapiApp",
    "packageNamePascalConstant": "MY_FASTAPI_APP",
    "packageNamePascalPath": "MyFastapiApp",
    "packageNameConstantKebab": "my-fastapi-app",
    "packageNameConstantSnake": "my_fastapi_app",
    "packageNameConstantCamel": "myFastapiApp",
    "packageNameConstantPascal": "MyFastapiApp",
    "packageNameConstantConstant": "MY_FASTAPI_APP",
    "packageNameConstantPath": "MY_FASTAPI_APP",
    "packageNamePathKebab": "my-fastapi-app",
    "packageNamePathSnake": "my_fastapi_app",
    "packageNamePathCamel": "myFastapiApp",
    "packageNamePathPascal": "MyFastapiApp",
    "packageNamePathConstant": "MY_FASTAPI_APP",
    "packageNamePathPath": "my_fastapi_app"
  },
  "files": [
    ".env.example",
    ".gitignore",
    "README.md",
    "config/logging.json",
    "config/otel.json",
    "config/postgres.json",
    "pyproject.toml",
    "src/my_fastapi_app/__init__.py",
    "src/my_fastapi_app/bootstrap/__init__.py",
    "src/my_fastapi_app/bootstrap/application.py",
    "src/my_fastapi_app/bootstrap/routes.py",
    "src/my_fastapi_app/features/__init__.py",
    "src/my_fastapi_app/features/authentication_users/__init__.py",
    "src/my_fastapi_app/features/authentication_users/models.py",
    "src/my_fastapi_app/features/authentication_users/repository.py",
    "src/my_fastapi_app/features/authentication_users/router.py",
    "src/my_fastapi_app/features/authentication_users/schemas.py",
    "src/my_fastapi_app/features/authentication_users/service.py",
    "src/my_fastapi_app/features/authentication_users/tests/__init__.py",
    "src/my_fastapi_app/features/authentication_users/tests/test_router.py",
    "src/my_fastapi_app/main.py",
    "src/my_fastapi_app/shared/__init__.py",
    "src/my_fastapi_app/shared/config/__init__.py",
    "src/my_fastapi_app/shared/config/settings.py",
    "src/my_fastapi_app/shared/errors/__init__.py",
    "src/my_fastapi_app/shared/errors/handlers.py",
    "src/my_fastapi_app/shared/infrastructure/__init__.py",
    "src/my_fastapi_app/shared/logging/__init__.py",
    "src/my_fastapi_app/shared/logging/configuration.py",
    "tests/unit/test_unit.py"
  ]
}