{
  "schemaVersion": 1,
  "generator": "@naresh007/project-structure-generator",
  "generatorVersion": "0.2.3",
  "generatedAt": "2026-08-06T09:01:46.847Z",
  "blueprint": {
    "kind": "blueprint",
    "id": "react-feature-based",
    "source": "built-in",
    "version": "1.0.0"
  },
  "maturity": "standard",
  "capabilities": [],
  "variables": {
    "projectName": "my-react-app",
    "projectNameKebab": "my-react-app",
    "projectNameSnake": "my_react_app",
    "projectNameCamel": "myReactApp",
    "projectNamePascal": "MyReactApp",
    "projectNameConstant": "MY_REACT_APP",
    "projectNamePath": "my-react-app",
    "projectNameKebabKebab": "my-react-app",
    "projectNameKebabSnake": "my_react_app",
    "projectNameKebabCamel": "myReactApp",
    "projectNameKebabPascal": "MyReactApp",
    "projectNameKebabConstant": "MY_REACT_APP",
    "projectNameKebabPath": "my-react-app",
    "projectNameSnakeKebab": "my-react-app",
    "projectNameSnakeSnake": "my_react_app",
    "projectNameSnakeCamel": "myReactApp",
    "projectNameSnakePascal": "MyReactApp",
    "projectNameSnakeConstant": "MY_REACT_APP",
    "projectNameSnakePath": "my_react_app",
    "projectNameCamelKebab": "my-react-app",
    "projectNameCamelSnake": "my_react_app",
    "projectNameCamelCamel": "myReactApp",
    "projectNameCamelPascal": "MyReactApp",
    "projectNameCamelConstant": "MY_REACT_APP",
    "projectNameCamelPath": "myReactApp",
    "projectNamePascalKebab": "my-react-app",
    "projectNamePascalSnake": "my_react_app",
    "projectNamePascalCamel": "myReactApp",
    "projectNamePascalPascal": "MyReactApp",
    "projectNamePascalConstant": "MY_REACT_APP",
    "projectNamePascalPath": "MyReactApp",
    "projectNameConstantKebab": "my-react-app",
    "projectNameConstantSnake": "my_react_app",
    "projectNameConstantCamel": "myReactApp",
    "projectNameConstantPascal": "MyReactApp",
    "projectNameConstantConstant": "MY_REACT_APP",
    "projectNameConstantPath": "MY_REACT_APP",
    "projectNamePathKebab": "my-react-app",
    "projectNamePathSnake": "my_react_app",
    "projectNamePathCamel": "myReactApp",
    "projectNamePathPascal": "MyReactApp",
    "projectNamePathConstant": "MY_REACT_APP",
    "projectNamePathPath": "my-react-app"
  },
  "files": [
    ".env.example",
    ".gitignore",
    "README.md",
    "index.html",
    "package.json",
    "src/app/App.tsx",
    "src/app/providers.tsx",
    "src/app/routes.tsx",
    "src/components/shared/README.md",
    "src/components/ui/README.md",
    "src/config/environment.ts",
    "src/features/README.md",
    "src/features/auth/api/client.ts",
    "src/features/auth/components/AuthView.tsx",
    "src/features/auth/hooks/useAuth.ts",
    "src/features/auth/index.ts",
    "src/features/auth/schemas/auth.schema.ts",
    "src/features/auth/tests/AuthView.test.tsx",
    "src/features/auth/types/index.ts",
    "src/main.tsx",
    "src/vite-env.d.ts",
    "tsconfig.json",
    "vite.config.ts"
  ]
}